"organization","slug","dataset","resource","url","operations","columns","fact","status"
"CDI","cdi","Catalogo de localidades indígenas 2010","Localidades indigenas 2010","http://www.cdi.gob.mx/datosabiertos/2010/locali-indi-2010.csv","Procedimiento en Bash","B,K","En 2010 la población indígena total registrada en el territorio mexicano es de 11,132,562 de individuos.","1"
"CDI","cdi","Catalogo de localidades indígenas 2010","Localidades indigenas 2010","http://www.cdi.gob.mx/datosabiertos/2010/locali-indi-2010.csv","Procedimiento en Bash","B,K","En 2010 el estado con mayor población indígena fue Oaxaca con 5,158,392 de individuos.","1"
"CDI","cdi","Distribución de los pueblos indígenas por entidad federativa","Pueblos indígenas por estado, 2010","http://www.cdi.gob.mx/datosabiertos/2010/pueb-indi-edo-2010.csv","Procedimiento en Bash","A,C","En 2010 el pueblo indígena con mayor población a nivel nacional es Náhuatl con 2,587,452 individuos.","1"
"CDI","cdi","Distribución de los pueblos indígenas por entidad federativa","Pueblos indígenas por estado, 2010","http://www.cdi.gob.mx/datosabiertos/2010/pueb-indi-edo-2010.csv","Procedimiento en Bash","A,C","En 2010 el pueblo indígena con menor población a nivel nacional es Ayapaneco con 57 individuos","1"
"INMUJERES","inmujeres","Estadísticas de mujeres","Mujeres propietarias de la vivienda","http://datos.inmujeres.gob.mx/archivo.php?f=f4244&t=csv","tabla","B,C","De 2006 a 2012, el número de mujeres propietarias de vivienda en el país se elevó de 7'499,632 a 8'647,264, representando una tasa de crecimiento en este rubro de 15.30%.","0"
"INMUJERES","inmujeres","Estadísticas de mujeres","Mujeres sin ingresos propios","http://datos.inmujeres.gob.mx/archivo.php?f=f4246&t=csv","tabla","A,C,D","El porcentaje de mujeres mayores de 15 años sin ingresos propios a nivel nacional se redujo de 32.16% (2008) a 29.86% (2010)","1"
"INMUJERES","inmujeres","Estadísticas de mujeres","Mujeres en puestos directivos de la administración pública","http://datos.inmujeres.gob.mx/archivo.php?f=f4243&t=csv","tabla","B,C","El número de mujeres en puestos directivos de la administración pública a nivel nacional se elevó de 21,867 (2005) a 29,611 (2014), es decir, más del 35%.","1"
"INMUJERES","inmujeres","Estadísticas de mujeres","Senadoras","http://datos.inmujeres.gob.mx/archivo.php?f=f4245&t=csv","tabla","B,C","El número de senadoras se elevó de 24 (2004) a 44 (2014), es decir, más del 80%.","1"
"ISSSTE","issste","Número de pensiones vigentes y gasto ejercido","Tabla del número de pensiones vigentes y gasto ejercido por Delegación en forma trimestral, del régimen del artículo Décimo Transitorio","http://www.issste.gob.mx/datosabiertos/pensionesvigentes.csv","tabla","B,D,F,H","El estado con el mayor gasto en pensiones durante los primeros 3 semestres de 2015 es Estado de México con 6,223.2 millones de pesos.","1"
"ISSSTE","issste","Numero de pensiones otorgadas","Tabla del número de pensiones otorgadas por Delegación en forma trimestral, del régimen del artículo décimo transitorio","http://www.issste.gob.mx/datosabiertos/pensionesvigentes.csv","tabla","A,B,C,D","El Distrito Federal es la entidad federativa que más pensiones de Décimo Transitorio ha otorgado en 2015, con un total de 11,227","0"
"ISSSTE","issste","Número de pensiones vigentes y gasto ejercido","Tabla del número de pensiones vigentes y gasto ejercido por Delegación en forma trimestral, del régimen del artículo Décimo Transitorio","http://www.issste.gob.mx/datosabiertos/pensionesvigentes.csv","tabla","B,D,F,H","El conjunto de estados con el mayor gasto en pensiones durante los primeros 3 semestres de 2015 está conformado por Chiapas, Guerrrero, Oaxaca, Campeche, Quintana Roo, Tabásco y Yucatán con 8,323.37 millones de pesos.","1"
"ISSSTE","issste","Eventos culturales, sociales, deportivos y recreativos","Tabla de los eventos culturales, sociales, deportivos y recreativos que ofrece al ISSSTE mensualmente por Entidad Federativa","http://www.issste.gob.mx/datosabiertos/calendariodeeventos.csv","tabla","A,J","El número de Servicios de Fomento Deportivo otorgadaos a pensionados pasó de 223,089 en 2013 a 247,559 en 2014; es decir, tuvo un crecimiento del 10.97%.","0"
"PGR","pgr","ATENCION CIUDADANA DGPDSC-CEDAC","Atención Ciudadana DGPDSC-CEDAC","http://pgrarchivos.blob.core.windows.net/datos-abiertos/CEDAC.rar","tabla","A,B","Durante el 2015, se han llevado a cabo 7,342 casos de atención ciudadana, brindada a las diferentes solicitudes por la DGPDSC a través del CEDAC (Psicológicas, Legales y Sociales). En Nuevo León es en el estado donde más casos se han registrado (1,045).","0"
"PGR","pgr","Estadística de detenidos","Base de datos","http://pgrarchivos.blob.core.windows.net/datos-abiertos/Personas%20Detenidas%20Ene-Sep2015.rar","tabla","D,I","El estado con menor número de personas detenidas durante 2015 ha sido Yucatán, con un total de 69","1"
"PGR","pgr","CURSO DE CAPACITACIÓN EN MATERIA DE DERECHOS HUMANOS","Base de datos","http://pgrarchivos.blob.core.windows.net/datos-abiertos/DIRECCI%C3%93N%20PROMOCI%C3%93N%20DE%20LA%20CULTURA.rar","tabla","A,C","En lo que va del 2015, se han impartido 85 cursos de capacitación en materia de derechos humanos por parte de PGR a través de la Dirección General de Promoción de la Cultura en Derechos Humanos.","0"
"PGR","pgr","Incidencia Delictiva 2012-2016","Base de datos","http://pgrarchivos.blob.core.windows.net/datos-abiertos/Incidencia%20Delictiva%20Ene2012-Sep2015.rar","tabla","B,D-AE","El estado con menor número total de incidencias delictivas entre 2012 y 2015 es Campeche con 2,568","1"
"PRESIDENCIA","presidencia","MÉXICO CON RESPONSABILIDAD GLOBAL- ESTADÍSTICAS NACIONALES","Cooperación internacional Concepto","https://dl.dropboxusercontent.com/u/47709433/Anexo_Estadistico_Excel/P768_ABAJO.xlsx","tabla","A-Q","Del 2000 al 2014, se han firmado en México 342 tratados bilaterales y multilaterales para la cooperación internacional, incluyendo tratados culturales y educativos, cooperación general, asuntos consulares, etc.","0"
"PRESIDENCIA","presidencia","Concentrado de peticiones al C. Presidente","Relación de peticiones dirigidas al C. Presidente de mayo de 2014 a septiembre de 2016","https://drive.google.com/uc?export=download&id=0Bw1YBQEbBwzDSTlHdk83SElpakU","tabla","A","Entre Mayo 2014 y Septiembre de 2015, hubo un total de 89,810 peticiones al C. Presidente","1"
"PRESIDENCIA","presidencia","Histórico del catálogo de conjuntos de Datos Abiertos en datos.gob.mx","Histórico del catálogo de recursos de Datos Abiertos en datos.gob.mx","https://drive.google.com/uc?export=download&id=0Bw1YBQEbBwzDT0ZDWXNWMTZWR0U","tabla","C","En el periodo de julio 2014 a noviembre de 2015, 150 dependencias, estados y ayuntamientos publicaron conjuntos en datos.gob.mx para hacerlos públicos.","1"
"PRESIDENCIA","presidencia","Histórico del catálogo de conjuntos de Datos Abiertos en datos.gob.mx","Histórico del catálogo de recursos de Datos Abiertos en datos.gob.mx","https://drive.google.com/uc?export=download&id=0Bw1YBQEbBwzDT0ZDWXNWMTZWR0U","tabla","A","El total de bases de datos abiertos publicados por parte de las dependencias, estados y ayuntamientos supero los 70,000 recursos en el periodo de julio 2014 a noviembre de 2015 ","1"
"SAGARPA","sagarpa","Apoyos otorgados en 2013 SAGARPA","Apoyos de la Cruzada contra el Hambre, 2013","http://www.sagarpa.gob.mx//quienesomos/datosabiertos/sagarpa/Documents/sagarpa_apoyo_cruzada.zip","Procedimiento en Bash","F","Durante el 2013 se registraron 86,474 apoyos al proyecto ""Procampo Productivo""","1"
"SAGARPA","sagarpa","Apoyos otorgados en 2013 SAGARPA","Apoyos de la Cruzada contra el Hambre, 2013","http://www.sagarpa.gob.mx//quienesomos/datosabiertos/sagarpa/Documents/sagarpa_apoyo_cruzada.zip","Procedimiento en Bash","F","Durante el 2013 se registraron 1,565 apoyos al proyecto ""Preveneción y Manejo de Riesgos""","1"
"SAGARPA","sagarpa","Estadística de Producción Agrícola. SIAP","Estadística de la Producción Agrícola 2013.","http://www.sagarpa.gob.mx//quienesomos/datosabiertos/siap/estadistica//Agt_cierre_2013.csv","Procedimiento en Bash","","En el 2013 se registró una producción agrícola con valor aproximado de  12,723,000 MXN","1"
"SAGARPA","sagarpa","Estadística de Producción Agrícola. SIAP","Estadística de la Producción Agrícola 2013.","http://www.sagarpa.gob.mx//quienesomos/datosabiertos/siap/estadistica//Agt_cierre_2013.csv","Procedimiento en Bash","J","En el 2013 el mayor número de registros de cultivos fue por ""Maíz grano"" con 5,003 registros seguido del ""Frijol"" con 3,681 registros","1"
"SALUD","salud","Consultas Médicas del Hospital General de México ""Dr. Eduardo Liceaga""","Consultas Otorgadas 2014","http://www.hgm.salud.gob.mx/descargas/pdf/focalizada/CONSULTAS_OTORGADAS-2014.csv","tabla","A,D","Durante el 2014, se otorgaron  705,125 consultas por parte de las especialidades médicas del Hospital ""Dr. Eduardo Liceaga"", 705,125 fueron a mujeres y 235,928 a hombres","1"
"SALUD","salud","Nacimientos ocurridos","Registro de Nacimientos 2008","http://www.dgis.salud.gob.mx/descargas/datosabiertos/sinac_2008.zip","Procedimiento en Bash","AA","Se registraron, mediante la Secretaría de salud, un total de  1'980,369 nacimientos en 2008; de ellos, 1'008,379 fueron hombres y 971,990, mujeres.","1"
"SALUD","salud","Recursos en salud","Recursos en Salud 2014","http://www.dgis.salud.gob.mx/descargas/datosabiertos/recursos_salud_2014.zip","Procedimiento en Bash","AH","Se registraron  un total de 31,087 individuos de personal técnico en el 2014.","1"
"SALUD","salud","Recursos en salud","Recursos en Salud 2014","http://www.dgis.salud.gob.mx/descargas/datosabiertos/recursos_salud_2014.zip","Procedimiento en Bash","","Se registraron un total de 11,869 medicos generales en el 2014.","1"
"SCT","sct","Infraestructura Carretera","Clasificación de Carreteras","http://data.sct.gob.mx:8082/datos/datos/abiertos/21401ClasificacionCarreteras.csv","tabla","E","El total de longitud de las carreteras clasificadas de Jurisdicción Federal en México es 73,989.79 kilómetros.","0"
"SCT","sct","Infraestructura Carretera","Tarifas Vigentes de las Vías Federales de Cuota","http://data.sct.gob.mx:8082/datos/datos/abiertos/21401TarifasVigentes.csv","tabla","A,E","Entre el 2012 y el 2014, la tarifa más barata en carreteras federales se registró con un costo (con IVA) de $2.00 en la carretera Lago de Guadalupe - Ent. San Miguel","1"
"SCT","sct","Infraestructura Marítimo-Portuaria","Flota activa de embarcaciones menores a 100 esloras","http://data.sct.gob.mx:8082/datos/datos/abiertos/51101DGMM02MENORESA100MDEESLORA.csv","tabla","A,H","En lo que va del 2015, se han registrado un total de 1,305 entradas de cruceros (tomando sólo embarcaciones menores a 100 esloras) a los puertos de de las distintas entidades de la república; el puerto de Cozumel es el que mayor número de entradas ha registrado (668).","1"
"SCT","sct","Infraestructura Ferroviaria","Empresas ferroviarias y personal","http://data.sct.gob.mx:8082/datos/datos/abiertos/31101PEREMPRESAFERROVIARIA.csv","tabla","A,D","Hasta el 2014, en México operaban 13 empresas ferroviarias que empleaban a más de 8,000 personas. ","1"
"SE","se","Número de mujeres rurales microacreditadas","Mujeres rurales microacreditadas por entidad federativa del periodo abril-junio 2015","http://www.datos.economia.gob.mx/FOMMURCreditos2doTrim-20151019.csv","tabla","A,B","El número total de mujeres rurales con acceso a crédito, entre abril y junio 2015, es 148,620.","0"
"SE","se","Estadística Minera","Volumen y valor","https://drive.google.com/uc?export=download&id=0B-4W2dww7ELNR3pfZzlRQm96UTQ","tabla","D,E","El valor total de la minería metalúrgica se elevó de $94'816,874.50 (2009) a $200'946,361.96 (2013); es decir, tuvo una tasa de crecimiento del 111.93%","1"
"SE","se","Estadística Minera","México en el mundo","https://drive.google.com/uc?export=download&id=0B-4W2dww7ELNbklqN2Jvb1dzY3M","tabla","A,B,C,E","México se mantuvo como el primer lugar productor de plata a nivel mundial de 2010 a 2013, produciento en éste (2013) el 26.36% del total mundial de dicho metal.","1"
"SE","se","Registro Nacional de Inversiones Extranjeras","Listado del Registro de Empresas Extranjeras inscritas en el RNIE que realizan actos de comercio en México","http://www.datos.economia.gob.mx/Personasmoralesextranjeras.xls","tabla","A,C","Existen 707 empresas extranjeras, de más de 45 países, registradas y comerciando en nuestro país.","1"
"SECTUR","sectur","Campañas Institucionales","Campañas Institucionales","http://www.datatur.sectur.gob.mx/Documentos%20compartidos/CPTM_BD_Campanas2013_2014DEM.csv","tabla","B,D","El número de Campañas Institucionales de turismo se elevó de 13 en 2013 a 72 en 2014.","1"
"SECTUR","sectur","Campañas Institucionales","Campañas Institucionales","http://www.datatur.sectur.gob.mx/Documentos%20compartidos/CPTM_BD_Campanas2013_2014DEM.csv","tabla","B,C","El estado que mayor número de Campañas Institucionales de turismo presentó en el último par de años (2013-14) fue Yucatán con un total de 7. ","1"
"SECTUR","sectur","Actividad Hotelera por Entidad Federativa","Actividad Hotelera por Entidad Federativa","http://www.datatur.beta.sectur.gob.mx/Documentos%20compartidos/6_1_td.csv","tabla","B,D","La actividad hotelera, entre 2000 y 2014, ha registrado un total de 1,168'122,657 de turistas (extranjeros y nacioales) en ocupación de hotel; la entidad federativa con mayor registro fue el DF (153'932,026), seguido de Quintana Roo (113'291,068)","1"
"SECTUR","sectur","Servicios de Auxílio Turístico de la Corporación Ángeles Verdes","Servicios de Auxílio Turístico de la Corporación Ángeles Verdes de la Secretaría de Turismo (SECTUR)","http://www.datatur.sectur.gob.mx/Documentos%20compartidos/AV_BD_Servicios_2014.csv","tabla","A,C","Durante el 2014, se registraron 164,361 Servicios de auxílio turístico de la corporación Ángeles Verdes; en Nuevo León fue en donde mayor número se registró (12,608).","1"
"SEDATU","sedatu","ODS SEDATU","Rezago habitacional por condiciones de espacio, materiales e instalaciones de la vivienda","https://drive.google.com/uc?export=download&id=0B8H92S-nvsXedU5qQWpGYXB6WG8","tabla","D","El rezago habitacional total, calculado con el Modulo de Condiciones Socieconómicas de la ENIGH 2014 ascendió a 13,619,650","1"
"SEDATU","sedatu","ODS SEDATU","Densidad de población (bruta)","https://drive.google.com/uc?export=download&id=0B8H92S-nvsXeSV92SUpmQktUOUE","Rutina en R","G","La densidad poblacional  bruta promedio a nivel nacional por km² en el 2015 es de 297.5938 personas/km²","1"
"SEDATU","sedatu","ODS SEDATU","Densidad de población (bruta)","https://drive.google.com/uc?export=download&id=0B8H92S-nvsXeSV92SUpmQktUOUE","Rutina en R","A,G","Con base en datos del 2015, El Distrito Federal tiene la mayor densidad poblacional bruta por de 5,907 personas/km²","1"
"SEDATU","sedatu","ODS SEDATU","Residuos sólidos urbanos manejados adecuadamente","https://drive.google.com/uc?export=download&id=0B8H92S-nvsXeVVFvMnlOZUwxWGs","tabla","","En promedio el 27.89% de los residuos sólidos urbanos a nivel nacional son tratados.","1"
"SEDENA","sedena","Adquisiciones (Contratos)","Adquisición de Bienes y Servicios.","http://www.sedena.gob.mx/archivos/datosabiertos/contratos2015.xls","Procedimiento en Bash","B","En el 2015 la SEDENA realizo 113 contratación por medio de licitación pública","0"
"SEDENA","sedena","Adquisiciones (Contratos)","Adquisición de Bienes y Servicios.","http://www.sedena.gob.mx/archivos/datosabiertos/contratos2015.xls","Procedimiento en Bash","H","En el 2015 la SEDENA realizo contrataciones por un valor de 1,719,156,197 de pesos","0"
"SEDENA","sedena","Obras ejecutadas para beneficio de la Secretaría de la Defensa Nacional","Cantidad de obras ejecutadas en el año 2015","http://www.sedena.gob.mx/archivos/datosabiertos/obras2015.csv","Procedimiento en Bash","A","SEDENA ha realizado 40 obras en lo que va del 2015","0"
"SEDENA","sedena","Obras ejecutadas para beneficio de la Secretaría de la Defensa Nacional","Cantidad de obras ejecutadas en el año 2014","http://www.sedena.gob.mx/archivos/datosabiertos/obras2014.csv","Procedimiento en Bash","","SEDENA realizó 74 obras en el 2014","0"
"SEDESOL","sedesol","Programa de Comedores Comunitarios 2015","COMEDORES 2015 enero a marzo","http://datos.sedesol.gob.mx/padronbeneficiarios/150706/cp/comedores_151_153.zip","tabla","C","Durante el primer trimestre de 2015, el programa de Comedores Comunitarios benefició a 413,787 personas, mediante 43,470 comedores que proporcionan alimentos nutritivos y en cantidad suficiente.","1"
"SEDESOL","sedesol","Instituto Mexicano de la Juventud","IMJUVE enero a junio 2014","http://datos.sedesol.gob.mx/padronbeneficiarios/140930/sp/IMJUVE_141_146.csv","tabla","A,F","4,129 jóvenes (entre 12 y 29 años) fueron beneficiados con alguno de los apoyos del Instituto Mexicano de la Juventud durante el primer semestre de 2014. 2140 fueron hombres, 1989 mujeres.","1"
"SEDESOL","sedesol","Programa Pensión para Adultos Mayores 2015","PAM 2015 mayo a junio","http://datos.sedesol.gob.mx/padronbeneficiarios/150930/cp/pam_155_156.zip","tabla","H,I","En el tercer bimestre de 2015, se apoyaron a 5'216,809 adultos mayores de 65 años con un total de $6,051,498,440.00 ($1,160 cada uno) mediante el programa Pensión para Adultos.","1"
"SEDESOL","sedesol","Programa de Abasto Social de Leche a Cargo de LICONSA, S.A. de C.V. 2015","PASL 2015 julio","http://datos.sedesol.gob.mx/padronbeneficiarios/150930/cp/pasl_157_157.zip","tabla","F,H","Durante Junio de 2015, un total de 9,550,946
 personas fueron beneficiarias del programa de Abasto Social de Leche (gratuita o a bajo costo), con un total de 100,459,600 de litros de leche.
","1"
"SEGOB","segob","Registro de atenciones brindadas por el Programa Paisano","Tabla de registro de atenciones brindadas por el Programa Paisano","http://www.inm.gob.mx/datos/2015/DPMYV/ProgramaPaisano/atenciones-brindadas-programa-paisano.csv","tabla","A,C,D,E,F","Se apoyó a 2'094,461 personas en el periodo Mayo-Agosto mediante el programa Paisano. El estado que más apoyo dio fue Jalisco (730,281 en dicho periodo).","1"
"SEGOB","segob","Volcan Activos en Mexico","Volcan Activos en Mexico","http://132.248.68.83/portal/images/PHPcenapred/index/fase1/Geologicos/","Conteo en Mapa","No Aplica","Existen actualmente 67 volcanes activos en el terriotorio mexicano (incluyendo todos los tipos: volcán escudo, submarino, caldera, etc.).","1"
"SEGOB","segob","Iniciativas del Ejecutivo Federal","Reporte de iniciativas presentadas por el Ejecutivo Federal a partir del 1 de diciembre de 2012, por estatus","http://sil.gobernacion.gob.mx/Reportes/GeneracionReportes/reporteAutomatico1.php?TipoReporte=1&Periodo=3/da","Interpretación gráfica","No Aplica","En el peridodo del sexenio actual, se han presentado 84 iniciativas por parte del Ejecutivo Federal, de las cuales 62 han sido aprovadas y publicadas en el DOF.","1"
"SEGOB","segob","Migrantes atendidos por los Grupos Beta de Proteccion a Migrantes","Reporte mensual de actividades sobre las atenciones otorgadas a los migrantes por parte de los 22 Grupos Beta de Proyeccion a Migrantes","http://www.inm.gob.mx/datos/2015/DPMYV/GruposBeta/migrantes-atendidos-por-grupos-beta.csv","tabla","B,C","En un mes, los grupos Beta de Protección a Migrantes atendieron a 61,922 migrantes (mediante rescate y salvamento, ayuda humanitaria, asesoría legal y orientación). Chiapas fue el estado en donde más se atendió con 22,404 migrantes atendidos.","1"
"SEMARNAT","semarnat","Agua residual que recibe tratamiento","Agua residual municipal e industrial que recibe tratamiento como porcentaje del agua residual generada.","http://dsiappsdev.semarnat.gob.mx/datos/Tratamiento.csv","Rutina en R","A,J","El porcentaje de agua tratada con respecto al total de agua generada paso de 15.76% en 1998 a 37.81% en el 2013","1"
"SEMARNAT","semarnat","Agua Residual que recibe tratamiento","Agua residual que recibe tratamiento por entidad federativa","http://dsiappsdev.semarnat.gob.mx/datos/Tratamiento_X_ent_federativa.csv","Rutina en R","A,D","El estado que trató el mayor porcentaje de agua en el 2013 fue Nuevo León con 117.2%","1"
"SEMARNAT","semarnat","Eficencia en el uso del agua en el sector agrícola de riego","Eficiencia en el uso del agua en el sector agrícola de riego","http://dsiappsdev.semarnat.gob.mx/datos/Eficiencia_agr%C3%ADcola.csv","Rutina en R","A, E","La eficiencia en el uso de agua en el sector agrícola paso de 1.11 en el periodo 1994-1995 a 1.84 en el periodo 2012-2013","1"
"SEMARNAT","semarnat","Grado de Presión de los recursos hídricos","Grado de Presión de los recursos hídricos","http://dsiappsdev.semarnat.gob.mx/datos/Grado_presion_Nacional.csv","Rutina en R","C,F","El grado de presión de los recursos hídricos paso de 15.4 en el 2001 a 17.3 en el 2013","1"
"SENER","sener","Volumen de las exportaciones de crudo por países","Volumen de las exportaciones de crudo por países.","http://200.23.166.35/DA/P/DGPlaneacionInformacionEnergeticas/VolumenExportacionesCrudoPaises/SENER_05_VolumenExportacionesCrudoPorPaises-PMXF1C01.csv","tabla","C,D","El nivel total de las exportaciones de crudo pasó de 795'665,077 barriles en 2010 a 1,204'504,598 en 2015, lo cual representa un crecimiento en exportaciones del 51.38% en 5 años.","1"
"SENER","sener","Ventas internas de energía eléctrica por entidad federativa.","Ventas internas de energía eléctrica por entidad federativa","http://200.23.166.35/DA/P/DGPlaneacionInformacionEnergeticas/VentasInternasEnergiaElectricaEntidadFederativa/SENER_05_VentasInternasEnergiaElectricaPorEntidadFederativa-IIIA3C06.csv","tabla","B,C","Las ventas internas de energía eléctrica tuvieron una tasa de crecimiento del 11.45%
 de 2010 a 2014 (de 186'638,877.9 a 208'014,911.6
 MWh).","1"
"SENER","sener","Ventas internas de energía eléctrica por entidad federativa.","Ventas internas de energía eléctrica por entidad federativa","http://200.23.166.35/DA/P/DGPlaneacionInformacionEnergeticas/VentasInternasEnergiaElectricaEntidadFederativa/SENER_05_VentasInternasEnergiaElectricaPorEntidadFederativa-IIIA3C06.csv","tabla","A,C","La entidad federativa que registra mayor nivel de ventas en energía eléctrica a partir del 2010 es el Estado de México (99'884,118.31 MWh), mientras que el que tiene el menor nivel es Campeche (7'046,004.26 MWh).","1"
"SENER","sener","Producción de petróleo crudo por entidad federativa (Estado de la República Mexicana","Producción de petróleo crudo por entidad federativa (Estado de la República Mexicana.","http://200.23.166.35/DA/P/DGPlaneacionInformacionEnergeticas/ProduccionPetroleoCrudoEntidadFederativa/SENER_05_ProduccionPetroleoCrudoPorEntidadFederativa-PMXB1C02.csv","tabla","B,D","Tabasco ha sido,en los últimos 6 años, el estado con mayor producción de petróleo crudo del país (con un total de 28,345.75 miles de barriles por día entre 2010 y 2015), y sólo superado por la producción en aguas territoriales.","1"
"SEP","sep","Censo de Escuelas, Maestros y Alumnos de Educación Básica y Especial","Personal Censado-Plazas","http://siged.sep.gob.mx:80/SIGED/content/conn/WCPortalUCM/path/Contribution%20Folders/PortalSIGED/Descargas/Datos%20Abiertos/Censo/Personal/PERSONAL_PLAZAS_CT_CENSADOS.zip","Rutina en bash","D,E","El municipio con mayor personal para la educación censado por la SEP es Tijuana con  5,4627 individuos.","1"
"SEP","sep","Censo de Escuelas, Maestros y Alumnos de Educación Básica y Especial","Personal Censado-Plazas","http://siged.sep.gob.mx:80/SIGED/content/conn/WCPortalUCM/path/Contribution%20Folders/PortalSIGED/Descargas/Datos%20Abiertos/Censo/Personal/PERSONAL_PLAZAS_CT_CENSADOS.zip","Rutina en bash","D","El estado con mayor personal para la educación censado por la SEP es el Estado de México con 343,185 individuos.","1"
"SEP","sep","Censo de Escuelas, Maestros y Alumnos de Educación Básica y Especial","Alumnos Censados en Centros de Trabajo","http://siged.sep.gob.mx/SIGED/content/conn/WCPortalUCM/path/Contribution%20Folders/PortalSIGED/Descargas/Datos%20Abiertos/Censo/Alumnos/ALUMNOS_CT_CENSADOS.zip?download","Rutina en bash","D,C","El municipio con mayor número de alumnos censados por la SEP es Puebla con 353,864 alumnos.","1"
"SEP","sep","Censo de Escuelas, Maestros y Alumnos de Educación Básica y Especial","Alumnos Censados en Centros de Trabajo","http://siged.sep.gob.mx/SIGED/content/conn/WCPortalUCM/path/Contribution%20Folders/PortalSIGED/Descargas/Datos%20Abiertos/Censo/Alumnos/ALUMNOS_CT_CENSADOS.zip?download","Rutina en bash","C","El estado con mayor número de alumnos censados por la SEP es el Estado de México con 3,410,547 alumnos.","1"
"SFP","sfp","Servidores públicos sancionados 2015-1","Servidores públicos sancionados 2015-1","https://siac.funcionpublica.gob.mx/DatosAbiertos/rsps/RSPS20151.csv","tabla","C","En el primer semestre de 2015, 4,228 funcionarios han sido sancionado por la Secretaría de la Función Pública y los órganos internos de control. ","1"
"SFP","sfp","Servidores públicos sancionados 2015-2","Servidores públicos sancionados 2015-2","https://siac.funcionpublica.gob.mx/DatosAbiertos/rsps/RSPS20151.csv","tabla","A","El número total de sanciones que se han aplicado a funcionarios por parte de la Secretaría de la Función Pública en y los órganos internos de control, durante el primer semestre de 2015, es de 5,053.","1"
